{
  "schemaVersion": "character_build.v1",
  "className": "warrior",
  "bodyType": "male",
  "layers": [
    { "slot": "body", "asset": "body.male", "variant": null },
    { "slot": "head", "asset": "head.human.male", "variant": null },
    { "slot": "face", "asset": "face.male.neutral", "variant": null },
    { "slot": "eyes", "asset": "eyes.human.neutral", "variant": "blue" },
    { "slot": "legs", "asset": "legs.pants2", "variant": "black" },
    { "slot": "feet", "asset": "feet.boots.rimmed", "variant": "black" },
    { "slot": "torso", "asset": "torso.armour.plate", "variant": null },
    { "slot": "hair", "asset": "hair.bedhead", "variant": null }
  ],
  "weapon": { "asset": "weapon.sword.katana", "enabled": true }
}
